{
  "schema": "atelier-claim@v1",
  "claimId": "claim:codex:2026-06-12:graph-contract-supports-analysis-boundary",
  "subject": "sample-architecture:fable-5-review-packet-mnstry-atelier-graph-contract",
  "predicate": "supports",
  "object": "sample-architecture:atelier-analysis-optional-install-decision",
  "provider": "codex",
  "status": "proposed",
  "promoted": false,
  "confidence": 0.67,
  "evidence": [
    "FABLE-5-REVIEW-PACKET-MNSTRY-ATELIER-GRAPH-CONTRACT.md#analysis-posture",
    "ATELIER-ANALYSIS-OPTIONAL-INSTALL-DECISION.md#authority-boundary"
  ],
  "createdAt": "2026-06-12T00:00:00Z"
}
